{
  "specversion": "1.0",
  "id": "evt_webhooktest012345",
  "type": "windforce.webhook.test",
  "source": "/workspaces/default/control-plane",
  "subject": "webhooks/whs_0123456789abcdef/test",
  "time": "2026-07-16T10:00:00Z",
  "datacontenttype": "application/json",
  "data": {
    "workspace": "default",
    "subscription_id": "whs_0123456789abcdef",
    "actor": "operator@example.test"
  }
}
